{
  "id": "pkg.utils",
  "path": "src/pkg/utils.py",
  "summary": "Shared utility helpers.",
  "role": "backend",
  "visibility": "internal",
  "stability": "evolving",
  "audiences": ["maintainers"],
  "doc_priority": "useful",
  "confidence": "medium",
  "public_api": [],
  "key_classes": [],
  "key_functions": ["normalize"],
  "dependencies": ["pkg.core"],
  "dependents": [],
  "extension_points": [],
  "lifecycle_notes": [],
  "documentation_hooks": [],
  "examples": [],
  "tests": [],
  "risks": [],
  "open_questions": [],
  "evidence": [{"kind": "import", "path": "src/pkg/utils.py", "detail": "pkg.core"}],
  "source_hash": "1111111111111111111111111111111111111111",
  "manual": {"notes": "", "editorial_status": "", "owner": "", "manual_summary": ""}
}
